2025-10-22 10:47:08,872 - __main__ - INFO - 🚀 Starting Complete Project Apply System
2025-10-22 10:47:08,873 - __main__ - INFO - ================================================================================
2025-10-22 10:47:08,873 - __main__ - INFO - 
📋 PHASE 1: Individual Branch Wake Testing
2025-10-22 10:47:08,873 - __main__ - INFO - --------------------------------------------------
2025-10-22 10:47:08,873 - __main__ - INFO - 
 Testing TikTok ML Branch (rama)
2025-10-22 10:47:09,208 - __main__ - INFO - ✅ TikTok ML Branch: Wake successful
2025-10-22 10:47:15,315 - __main__ - INFO - 
📱 Testing Meta Ads Branch (meta)
2025-10-22 10:47:15,857 - __main__ - INFO - ✅ Meta Ads Branch: Wake successful
2025-10-22 10:47:22,011 - __main__ - INFO - 
💬 Testing Like4Like Branch (tele)
2025-10-22 10:47:22,263 - __main__ - INFO - ✅ Like4Like Branch: Wake successful
2025-10-22 10:47:28,425 - __main__ - INFO - ✅ Phase 1 completed: All branches tested individually
2025-10-22 10:47:28,426 - __main__ - INFO - 
📋 PHASE 2: Code Quality Analysis
2025-10-22 10:47:28,427 - __main__ - INFO - --------------------------------------------------
2025-10-22 10:47:28,427 - __main__ - INFO -  Analyzing Python code quality...
2025-10-22 10:47:28,886 - __main__ - INFO - 📊 Python Analysis Results:
2025-10-22 10:47:28,886 - __main__ - INFO -   • Total files: 1158
2025-10-22 10:47:28,886 - __main__ - INFO -   • Total lines: 418,037
2025-10-22 10:47:28,886 - __main__ - INFO -   • Files with docstrings: 832/1158 (71.8%)
2025-10-22 10:47:28,886 - __main__ - INFO -   • Files with type hints: 659/1158 (56.9%)
2025-10-22 10:47:28,886 - __main__ - INFO -   • Long files (>500 lines): 225
2025-10-22 10:47:28,886 - __main__ - INFO -  Checking for common issues...
2025-10-22 10:47:29,292 - __main__ - WARNING - ⚠️ Found 130 potential issues:
2025-10-22 10:47:29,292 - __main__ - WARNING -   • Potential hardcoded credential in apply_system.py:269
2025-10-22 10:47:29,292 - __main__ - WARNING -   • Potential hardcoded credential in apply_system.py:270
2025-10-22 10:47:29,292 - __main__ - WARNING -   • Potential hardcoded credential in datastructures.py:172
2025-10-22 10:47:29,292 - __main__ - WARNING -   • Potential hardcoded credential in misc.py:474
2025-10-22 10:47:29,292 - __main__ - WARNING -   • Potential hardcoded credential in misc.py:477
2025-10-22 10:47:29,292 - __main__ - WARNING -   • Using print() instead of logging in __init__.py
2025-10-22 10:47:29,292 - __main__ - WARNING -   • Using print() instead of logging in config_generator.py
2025-10-22 10:47:29,292 - __main__ - WARNING -   • Using print() instead of logging in test_system.py
2025-10-22 10:47:29,292 - __main__ - WARNING -   • Using print() instead of logging in import_resolver.py
2025-10-22 10:47:29,292 - __main__ - WARNING -   • Using print() instead of logging in ml_client.py
2025-10-22 10:47:29,292 - __main__ - WARNING -   • ... and 120 more
2025-10-22 10:47:29,292 - __main__ - INFO -  Analyzing dependencies...
2025-10-22 10:47:29,312 - __main__ - INFO - 📦 Dependencies Analysis:
2025-10-22 10:47:29,312 - __main__ - INFO -   • Requirement files: 6
2025-10-22 10:47:29,312 - __main__ - INFO -   • requirements-dummy.txt: 7 dependencies
2025-10-22 10:47:29,313 - __main__ - INFO -   • requirements-ml.txt: 5 dependencies
2025-10-22 10:47:29,313 - __main__ - INFO -   • requirements-dev.txt: 11 dependencies
2025-10-22 10:47:29,313 - __main__ - INFO -   • requirements.txt: 30 dependencies
2025-10-22 10:47:29,313 - __main__ - INFO -   • requirements-full.txt: 21 dependencies
2025-10-22 10:47:29,313 - __main__ - INFO - ✅ Phase 2 completed: Code quality analysis done
2025-10-22 10:47:29,313 - __main__ - INFO - 
📋 PHASE 3: Applying Best Practices
2025-10-22 10:47:29,313 - __main__ - INFO - --------------------------------------------------
2025-10-22 10:47:29,313 - __main__ - INFO - 🛠️ Applying Python best practices...
2025-10-22 10:47:29,317 - __main__ - INFO - 🔧 Applied improvements to 7 files
2025-10-22 10:47:29,317 - __main__ - INFO - 🛡️ Enhancing error handling...
2025-10-22 10:47:29,318 - __main__ - INFO - 🛡️ Enhanced error handling in 1 files
2025-10-22 10:47:29,318 - __main__ - INFO -  Improving logging...
2025-10-22 10:47:29,318 - __main__ - INFO -  Logging configuration improved
2025-10-22 10:47:29,318 - __main__ - INFO - ️ Adding missing type hints...
2025-10-22 10:47:29,319 - __main__ - INFO - ️ Type hint analysis completed
2025-10-22 10:47:29,319 - __main__ - INFO - ✅ Phase 3 completed: Best practices applied
2025-10-22 10:47:29,319 - __main__ - INFO - 
📋 PHASE 4: Integration Testing
2025-10-22 10:47:29,319 - __main__ - INFO - --------------------------------------------------
2025-10-22 10:47:29,319 - __main__ - INFO -  Testing universal wake...
2025-10-22 10:47:34,685 - __main__ - INFO - ✅ Universal wake test passed
2025-10-22 10:47:38,009 - __main__ - INFO - 🔄 Testing cross-branch compatibility...
2025-10-22 10:47:38,010 - __main__ - INFO - 🔄 Cross-branch compatibility: 2/4 env files present
2025-10-22 10:47:38,010 - __main__ - INFO - 🚨 Testing error recovery...
2025-10-22 10:47:38,730 - __main__ - INFO - 🚨 Error recovery test: ✅ Passed
2025-10-22 10:47:38,731 - __main__ - INFO - ✅ Phase 4 completed: Integration testing done
2025-10-22 10:47:38,731 - __main__ - INFO - 
📋 PHASE 5: Documentation and Cleanup
2025-10-22 10:47:38,731 - __main__ - INFO - --------------------------------------------------
2025-10-22 10:47:38,731 - __main__ - INFO - 📚 Updating documentation...
2025-10-22 10:47:38,731 - __main__ - INFO - 📚 Documentation updated
2025-10-22 10:47:38,731 - __main__ - INFO - 📖 Creating development guide...
2025-10-22 10:47:38,732 - __main__ - INFO - 📖 Development guide created
2025-10-22 10:47:38,732 - __main__ - INFO - 🧹 Cleaning up temporary files...
2025-10-22 10:47:39,056 - __main__ - INFO - 🧹 Cleaned up 133 temporary files
2025-10-22 10:47:39,058 - __main__ - INFO - ✅ Phase 5 completed: Documentation and cleanup done
2025-10-22 10:47:39,058 - __main__ - INFO - 
📊 Generating Final Apply Report
2025-10-22 10:47:39,058 - __main__ - INFO - ================================================================================
2025-10-22 10:47:39,075 - __main__ - INFO - 
 APPLY SYSTEM COMPLETE!
2025-10-22 10:47:39,077 - __main__ - INFO - ================================================================================
2025-10-22 10:47:39,077 - __main__ - INFO - 🌿 BRANCH TESTING RESULTS:
2025-10-22 10:47:39,077 - __main__ - INFO -   • RAMA: ✅ PASSED
2025-10-22 10:47:39,077 - __main__ - INFO -   • META: ✅ PASSED
2025-10-22 10:47:39,078 - __main__ - INFO -   • TELE: ✅ PASSED
2025-10-22 10:47:39,078 - __main__ - INFO - 
📊 CODE QUALITY SUMMARY:
2025-10-22 10:47:39,078 - __main__ - INFO -   • Python files analyzed: 1158
2025-10-22 10:47:39,079 - __main__ - INFO -   • Total lines of code: 418,037
2025-10-22 10:47:39,079 - __main__ - INFO -   • Documentation coverage: 832/1158 (71.8%)
2025-10-22 10:47:39,079 - __main__ - INFO - 
 INTEGRATION TESTING:
2025-10-22 10:47:39,079 - __main__ - INFO -   • Universal wake: ✅ PASSED
2025-10-22 10:47:39,079 - __main__ - INFO - 
🛠️ IMPROVEMENTS APPLIED:
2025-10-22 10:47:39,079 - __main__ - INFO -   • Files enhanced: 7
2025-10-22 10:47:39,080 - __main__ - INFO -   • Error handling improved: ✅
2025-10-22 10:47:39,080 - __main__ - INFO -   • Logging configured: ✅
2025-10-22 10:47:39,082 - __main__ - INFO -   • Documentation updated: ✅
2025-10-22 10:47:39,082 - __main__ - INFO - 
🚀 NEXT STEPS:
2025-10-22 10:47:39,082 - __main__ - INFO -   1. Review the detailed report in logs/
2025-10-22 10:47:39,082 - __main__ - INFO -   2. Check README_APPLY.md for updated documentation
2025-10-22 10:47:39,082 - __main__ - INFO -   3. Read DEVELOPMENT_GUIDE.md for development guidelines
2025-10-22 10:47:39,082 - __main__ - INFO -   4. Use 'make wake' to test the enhanced system
2025-10-22 10:47:39,082 - __main__ - INFO -   5. Consider implementing the recommendations
2025-10-22 10:47:39,083 - __main__ - INFO - 
================================================================================
2025-10-22 10:47:39,083 - __main__ - INFO -  The Universal Automation Platform is now enhanced and ready!
2025-10-22 10:47:39,083 - __main__ - INFO - 📊 Detailed report saved: /workspaces/master/logs/apply_report_20251022_104739.json
2025-10-22 10:47:39,083 - __main__ - INFO -  Project Apply System completed successfully!
